date_found,category,level,city,organization,department,job_title,requirements,posted_date,deadline,application_route,source_url,source_type,evidence,suitability_reason,risks,key_hash,status
2026-06-29,今日新发现,B,北京,国家卫健委统计信息中心,调查评价处,数智管理与评价岗,硕士研究生及以上；专业含生物医学工程、临床医学、药学、公共卫生与预防医学、管理科学与工程、公共管理；社会人员；专业技术岗副高级。,2026-06-25,2026-07-07,登录国家卫生健康委人才交流服务中心委直属和联系单位公开招聘专区考生管理平台报名（https://www.21wecan.com）。,https://www.21wecan.com/wsrcw/zpgg/202606/1003122.shtml,nhc_talent_center_official,国家卫生健康委人才交流服务中心第二批公开招聘公告发布时间为 2026-06-25，附件《岗位信息表》可下载；岗位表第 1 行列出国家卫健委统计信息中心调查评价处数智管理与评价岗，岗位代码 92010101。,中央委直正式岗位，专业目录含公共卫生与预防医学，属于卫生数据评价与管理线索。,仅限北京市常住户口社会人员，且要求研究系列或工程系列副高及以上职称；岗位偏数据评价管理，不符合曹博士当前应届病原科研画像。,5e8c39731e,excluded
2026-06-29,今日新发现,B,北京,国家卫生健康委医疗管理服务指导中心,质量评价处,医疗质量管理岗,本科及以上；专业含临床医学、公共卫生与预防医学、公共卫生、社会医学与卫生事业管理；国内高校应届生；院校教育期间需有临床实习经历。,2026-06-25,2026-07-07,登录国家卫生健康委人才交流服务中心委直属和联系单位公开招聘专区考生管理平台报名（https://www.21wecan.com）。,https://www.21wecan.com/wsrcw/zpgg/202606/1003122.shtml,nhc_talent_center_official,第二批官方岗位表第 6 行列出国家卫生健康委医疗管理服务指导中心质量评价处医疗质量管理岗，岗位代码 92050101；公告明确网上报名时间为 2026-06-26 至 2026-07-07。,委直正式岗位，专业目录含公共卫生与预防医学/公共卫生，来源强且字段完整。,岗位要求北京市常住户口并需临床实习经历，方向偏医疗质量管理；同单位同名岗位已在 2026-06-09 历史检索中出现，今晚不重复升级。,7b569a8ef1,excluded
2026-06-29,今日新发现,B,北京,国家卫生健康委医疗管理服务指导中心,药械评价处,药械评价管理岗,本科及以上；专业含临床医学、公共卫生与预防医学、公共卫生、社会医学与卫生事业管理；国内高校应届生；院校教育期间需有临床实习经历。,2026-06-25,2026-07-07,登录国家卫生健康委人才交流服务中心委直属和联系单位公开招聘专区考生管理平台报名（https://www.21wecan.com）。,https://www.21wecan.com/wsrcw/zpgg/202606/1003122.shtml,nhc_talent_center_official,第二批官方岗位表第 8 行列出国家卫生健康委医疗管理服务指导中心药械评价处药械评价管理岗，岗位代码 92050103，招聘人数 2 人。,委直正式岗位，专业目录含公共卫生与预防医学，属于卫生政策与评价体系岗位。,岗位偏药械评价管理，要求北京市常住户口和临床实习经历，和曹博士病原生物学科研主线偏离，不按今晚新增 A/B 处理。,54c3318b06,excluded
2026-06-29,今日新发现,B,北京,国家卫生健康委医疗管理服务指导中心,数据运行处,信息数据与医疗机构运行管理岗,本科及以上；专业含临床医学、公共卫生与预防医学、公共卫生、社会医学与卫生事业管理；国内高校应届生；院校教育期间需有临床实习经历。,2026-06-25,2026-07-07,登录国家卫生健康委人才交流服务中心委直属和联系单位公开招聘专区考生管理平台报名（https://www.21wecan.com）。,https://www.21wecan.com/wsrcw/zpgg/202606/1003122.shtml,nhc_talent_center_official,第二批官方岗位表第 9 行列出国家卫生健康委医疗管理服务指导中心数据运行处信息数据与医疗机构运行管理岗，岗位代码 92050104。,委直正式岗位，专业目录含公共卫生与预防医学，可视为卫生数据治理方向线索。,岗位偏医疗机构运行管理和数据治理，要求北京市常住户口和临床实习经历，不是病原/检验/科研平台直岗。,23989102c2,excluded
2026-06-29,今日新发现,B,北京,北京急救中心,调度指挥中心,急救调度,硕士研究生及以上；专业为临床医学或基础医学；应届毕业生；从事院前医疗急救调度指挥相关工作。,2026-06-24,2026-07-03 16:00,填写《北京急救中心公开招聘登记报名表》后，发送至 zpxx120@wjw.beijing.gov.cn，邮件名“姓名+报考岗位”。,https://www.beijing.gov.cn/gongkai/rsxx/sydwzp/202606/t20260625_4714884.html,municipal_hr_official_hospital,北京市卫健委发布的北京急救中心 2026 年度第四批公开招聘公告正文与附件 1 职位表均可访问；附件第 2 行列出调度指挥中心急救调度岗位 1 人。,北京市卫健委直属事业单位正式岗，专业目录包含基础医学。,岗位实质为院前急救调度运行，临床执业和规培背景更优，和曹博士病原科研/公卫检测主线偏离，本轮排除。,c9a6da6e91,excluded
